{
  "topic": "microsoft-sentinel-graph",
  "description": "Microsoft Sentinel Graph — graph-based security analytics, incident graph, hunting graph, custom graphs",
  "tags": [
    "sentinel",
    "graph",
    "security",
    "microsoft",
    "siem",
    "defender"
  ],
  "sources": [
    {
      "url": "https://techcommunity.microsoft.com/blog/microsoft-security-blog/introducing-microsoft-sentinel-graph-public-preview/4456368",
      "title": "Introducing Microsoft Sentinel Graph Public Preview",
      "author": "Microsoft",
      "date": "Mar 2026",
      "priority": "P0",
      "summary": "Official announcement of Sentinel Graph public preview covering incident graph, hunting graph, data risk graph in Defender and Purview, and the before/after evolution from list-based to graph-based defense",
      "tags": [
        "incident-graph",
        "hunting-graph",
        "data-risk-graph"
      ],
      "addedAt": "2026-03-26T06:35:00Z",
      "addedBy": "gogoshaka"
    },
    {
      "url": "https://techcommunity.microsoft.com/blog/microsoftsentinelblog/what%E2%80%99s-new-in-microsoft-sentinel-rsac-2026/4503971",
      "title": "What's new in Microsoft Sentinel: RSAC 2026",
      "author": "Microsoft",
      "date": "Mar 2026",
      "priority": "P0",
      "summary": "Latest Sentinel announcements including Graph and agentic AI capabilities",
      "tags": [
        "agentic-ai"
      ],
      "addedAt": "2026-03-26T06:07:00Z",
      "addedBy": "gogoshaka"
    },
    {
      "url": "https://www.youtube.com/watch?v=U6rh0UnXZvg",
      "title": "Sentinel Graph Webinar",
      "author": "Microsoft",
      "date": "Mar 2026",
      "priority": "P0",
      "summary": "Video webinar deep-diving into Sentinel Graph features, hunting graph, incident graph, and graph-based defense capabilities",
      "tags": [
        "incident-graph",
        "hunting-graph"
      ],
      "addedAt": "2026-03-26T06:41:00Z",
      "addedBy": "gogoshaka"
    },
    {
      "url": "https://learn.microsoft.com/en-us/graph/api/resources/security-api-overview?view=graph-rest-1.0",
      "title": "Microsoft Graph Security API Documentation",
      "author": "Microsoft",
      "date": "",
      "priority": "P0",
      "summary": "API reference for Microsoft Graph Security integration",
      "tags": [
        "graph-api"
      ],
      "addedAt": "2026-03-26T06:07:00Z",
      "addedBy": "gogoshaka"
    },
    {
      "url": "https://collabsummit.eu/blog/microsoft-sentinel-agentic-security-platform",
      "title": "Introducing Microsoft Sentinel MCP and Sentinel Graph",
      "author": "CollabSummit",
      "date": "Oct 2025",
      "priority": "P1",
      "summary": "Core explainer of the Sentinel Graph model and MCP server",
      "tags": [
        "mcp-server"
      ],
      "addedAt": "2026-03-26T06:07:00Z",
      "addedBy": "gogoshaka"
    },
    {
      "url": "https://undercodetesting.com/microsoft-sentinels-graph-revolution-how-defenders-are-finally-fighting-back-at-scale/",
      "title": "Sentinel's Graph Revolution: How Defenders Are Finally Fighting Back",
      "author": "UnderCode",
      "date": "Oct 2025",
      "priority": "P1",
      "summary": "Deep dive on graph-based defense and attack path visualization",
      "tags": [
        "attack-path"
      ],
      "addedAt": "2026-03-26T06:07:00Z",
      "addedBy": "gogoshaka"
    },
    {
      "url": "https://windowsforum.com/threads/microsoft-sentinel-goes-agentic-ai-data-lake-graph-and-mcp-server.383130/",
      "title": "Microsoft Sentinel Goes Agentic AI: Data Lake, Graph, and MCP Server",
      "author": "WindowsForum",
      "date": "Sep 2025",
      "priority": "P2",
      "summary": "Overview of Sentinel Graph architecture alongside Data Lake and MCP",
      "tags": [
        "mcp-server"
      ],
      "addedAt": "2026-03-26T06:07:00Z",
      "addedBy": "gogoshaka"
    },
    {
      "url": "https://example.com/playwright-test",
      "title": "Playwright Test Source",
      "author": "",
      "date": "",
      "priority": "P2",
      "summary": "E2E test source created by Playwright",
      "tags": [
        "e2e-test"
      ],
      "addedAt": "2026-03-29T11:34:21.154Z",
      "addedBy": "playwright-test"
    }
  ]
}